{
	"typ": "Časová specifikace",
	"časový_interval": {
		"typ": "Časový interval",
		"začátek": {
			"typ": "Časový okamžik",
			"datum_a_čas": "2020-01-01T00:00:01"
		},
		"konec": {
			"typ": "Časový okamžik",
			"datum_a_čas": "2021-12-31T23:59:59"
		}
	},
	"frekvence": [
		"http://publications.europa.eu/resource/authority/frequency/BIWEEKLY"
	],
	"den_v_týdnu": [
		"https://data.mvcr.gov.cz/zdroj/číselníky/dny-v-týdnu/položky/pondělí"
	],
	"časová_doba": [
		"http://publications.europa.eu/resource/authority/timeperiod/OCT"
	]
}